{
  "spot_id": "synthetic_land_0_2",
  "quality_status": "good",
  "issues": [],
  "abstentions": [],
  "summary": "The description identifies a vacant undeveloped lot, which is consistent with the Land classification and supplied structured fields. No specific contradiction or material cross-field mismatch is evidenced."
}