{
  "spot_id": "synthetic_office_1_1",
  "quality_status": "critical",
  "issues": [
    {
      "claim_type": "property_use_and_configuration",
      "evidence_text": "Terreno baldío sin construcción",
      "structured_field": "type_name",
      "structured_value": "Office",
      "classification": "semantic_cross_field_mismatch",
      "actionable": true,
      "confidence": 0.99,
      "severity": "high",
      "reason": "The copy describes an undeveloped vacant lot with no construction, while the structured record classifies the property as an office."
    }
  ],
  "abstentions": [],
  "summary": "High-confidence mismatch between the listing copy and the structured office classification."
}