{
  "spot_id": "synthetic_land_1_1",
  "quality_status": "critical",
  "issues": [
    {
      "claim_type": "property_use_and_configuration",
      "evidence_text": "Espacio corporativo terminado con salas de juntas y recepción ejecutiva.",
      "structured_field": "type_name",
      "structured_value": "Land",
      "classification": "semantic_cross_field_mismatch",
      "actionable": true,
      "confidence": 0.99,
      "severity": "high",
      "reason": "The copy describes a completed corporate space with interior office facilities, which is materially inconsistent with the structured property type Land."
    }
  ],
  "abstentions": [],
  "summary": "The listing copy materially conflicts with the structured property type."
}