{
  "spot_id": "synthetic_warehouse_0_3",
  "quality_status": "review",
  "issues": [
    {
      "claim_type": "loading docks",
      "evidence_text": "andenes de carga",
      "structured_field": "amenities",
      "structured_value": "[]",
      "classification": "unsupported_claim",
      "actionable": false,
      "confidence": 0.98,
      "severity": "medium",
      "reason": "The description specifically claims loading docks, but the supplied amenities field is empty and no dedicated loading-dock field verifies this feature."
    },
    {
      "claim_type": "rack-suitable height",
      "evidence_text": "altura para racks",
      "structured_field": "vertical_height_m",
      "structured_value": null,
      "classification": "unsupported_claim",
      "actionable": false,
      "confidence": 0.98,
      "severity": "medium",
      "reason": "The description claims sufficient height for racks, but vertical_height_m is null, so the claim cannot be verified from the payload."
    }
  ],
  "abstentions": [],
  "summary": "The warehouse use is consistent with the structured type, but the description includes loading-dock and rack-height claims that are not supported by the supplied fields."
}